{
  "$schema": "schema/release_script.json",
  "iri_prefix": "https://galenos.org.uk/ontologies/",
  "full_repository_name": "b-gehrke/mental-health-ontology",
  "short_repository_name": "GMHO",
  "prefixes": {
    "GMHO": "https://galenos.org.uk/ontologies/GMHO_"
  },
  "external": {
    "target": {
      "file": "UpperLevel/gmho_external.owl",
      "iri": "https://galenos.org.uk/ontologies/gmho_external.owl"
    },
    "sources": [
      "UpperLevel/GMHO_External_Imports.xlsx"
    ]
  },
  "files": {
    "setting": {
      "target": {
        "file": "setting.owl",
        "iri": "https://galenos.org.uk/ontologies/setting.owl"
      },
      "sources": [
        "Intervention setting/Intervention setting.xlsx"
      ],
      "needs": []
    },
    "cad": {
      "target": {
        "file": "cad.owl",
        "iri": "https://galenos.org.uk/ontologies/cad.owl"
      },
      "sources": [
        "Intervention content and delivery/Intervention content and delivery.xlsx"
      ],
      "needs": []
    },
    "cse": {
      "target": {
        "file": "cse.owl",
        "iri": "https://galenos.org.uk/ontologies/cse.owl"
      },
      "sources": [
        "Intervention outcomes and spillover effects/Intervention outcomes and spillover effects.xlsx"
      ],
      "needs": []
    },
    "methods": {
      "target": {
        "file": "methods.owl",
        "iri": "https://galenos.org.uk/ontologies/methods.owl"
      },
      "sources": [
        "Research methods/Research methods.xlsx"
      ],
      "needs": []
    },
    "population": {
      "target": {
        "file": "population.owl",
        "iri": "https://galenos.org.uk/ontologies/population.owl"
      },
      "sources": [
        "Intervention population/Intervention population.xlsx"
      ],
      "needs": []
    },
    "mapped": {
      "target": {
        "file": "mapped.owl",
        "iri": "https://galenos.org.uk/ontologies/mapped.owl"
      },
      "sources": [
        "Non-GMHO entities mapped to LSRs/Non-GMHO entities mapped to LSRs.xlsx"
      ],
      "needs": []
    },
    "moa": {
      "target": {
        "file": "moa.owl",
        "iri": "https://galenos.org.uk/ontologies/moa.owl"
      },
      "sources": [
        "Intervention mechanism/Intervention mechanism of action.xlsx"
      ],
      "needs": []
    },
    "gmho": {
      "target": {
        "file": "gmho.owl",
        "iri": "https://galenos.org.uk/ontologies/gmho.owl"
      },
      "needs": [],
      "sources": [
        "setting.owl",
        "cad.owl",
        "cse.owl",
        "methods.owl",
        "population.owl",
        "mapped.owl",
        "moa.owl"
      ]
    }
  },
  "steps": [
    "PREPARATION",
    "VALIDATION",
    "IMPORT_EXTERNAL",
    "BUILD",
    "MERGE",
    "HUMAN_VERIFICATION",
    "GITHUB_PUBLISH"
  ]
}
